### ISSUE TITLE
Realtime Network flow observability

### ISSUE THREAD

**Issue by yp969803** [kmesh-net/kmesh#1282]
**What would you like to be added**:
Currently we have prometheus metrics for L4 metrics which is not realtime, and workload and service specific and connection specific. We need realtime informations about data flow from the kmesh daemon to a single place. 

We need a new component or pod which get the data flow streams from the kmesh daemons using grpc connections and show the information at terminal or UI

example of data flow informations
```
12:57:04.349545 IP yash-HP-Laptop-15s-fq2xxx.55284 > whatsapp-cdn-shv-01-bom1.fbcdn.net.https: Flags [P.], seq 3154854877:3154854947, ack 3192546737, win 555, options [nop,nop,TS val 4081302749 ecr 2295683567], length 70
12:57:04.433140 IP whatsapp-cdn-shv-01-bom1.fbcdn.net.https > yash-HP-Laptop-15s-fq2xxx.55284: Flags [.], ack 70, win 329, options [nop,nop,TS val 2295709428 ecr 4081302749], length 0
12:57:05.660493 IP6 yash-HP-Laptop-15s-fq2xxx.57330 > 2606:4700:90d2:7cbc:c2a5:436:5ff2:75c4.https: Flags [.], ack 916, win 559, options [nop,nop,TS val 135141772 ecr 1011920619], length 0
12:57:05.660886 IP6 yash-HP-Laptop-15s-fq2xxx.58386 > 2401:4900:7b3b:86de::b7.domain: 26948+ PTR? 52.16.240.157.in-addr.arpa. (44)
12:57:05.864567 IP6 2401:4900:7b3b:86de::b7.domain > yash-HP-Laptop-15s-fq2xxx.58386: 26948 1/0/0 PTR whatsapp-cdn-shv-01-bom1.fbcdn.net. (92)

```
**Why is this needed**:
Enhanced Observablity

**Comment by yp969803** [comment]
@LiZhenCheng9527 @nlgwcy @hzxuzhonghu what you think about this pr?

**Comment by hzxuzhonghu** [comment]
>We need a new component or pod which get the data flow informations streams from the kmesh daemons using grpc connections and show the information at terminal or UI

Take a look at https://opentelemetry.io/ , there are more and more cases using this standard

**Comment by yp969803** [comment]
i was suggesting a component similar to https://github.com/cilium/hubble

**Comment by hzxuzhonghu** [comment]
THis is not planned, we do rely on prometheus and grafana to show that metrics
